{
  "$schema": "https://json-schema.org/draft/2020-12/schema",
  "$id": "https://example.invalid/schemas/task-packet.schema.json",
  "title": "TaskPacket",
  "type": "object",
  "required": [
    "task_id",
    "requested_outcome",
    "skill_name",
    "source_refs",
    "constraints",
    "allowed_outputs"
  ],
  "properties": {
    "task_id": {"type": "string"},
    "requested_outcome": {"type": "string"},
    "skill_name": {"type": "string"},
    "source_refs": {"type": "array", "items": {"type": "string"}},
    "constraints": {"type": "array", "items": {"type": "string"}},
    "allowed_outputs": {"type": "array", "items": {"type": "string"}},
    "human_decision_required": {"type": "boolean"}
  },
  "additionalProperties": true
}
