{
  "task_id": "task-demo-gb-answer-001",
  "requested_outcome": "为 GB 车辆安全 demo 创建一个 citation-shaped answer packet。",
  "skill_name": "regulatory-answer",
  "source_refs": [
    "demos/gb-vehicle-safety"
  ],
  "constraints": [
    "仅用于公开 demo",
    "不要保存标准 PDF 正文",
    "除非取得授权来源文本，否则所有输出都标记为 synthetic"
  ],
  "allowed_outputs": [
    "answer_packet",
    "skill_run_log"
  ],
  "human_decision_required": false
}
